id,Original Sentence,Human 1 Writing,Human 1,Human 2 Writing,Human 2,GPT-3-zero-shot,GPT-3-few-shot,Muss
17,"Unlike the first film adaptation, in which director Samuel Fuller entirely wrote out the character of Gary, replaced Seberg with a younger fictional actress, and recast the story as a horror film centred on the dog itself, Barbeau-Lavalette remained more faithful to the original book.","In the first movie adaptation, Samuel Fuller removed Gary, replaced Seberg with a younger fictional actress, and made the story center on the dog. || Meanwhile, Barbeay-Lavalette’s movie adaptation was closer to the original book.",anton,"Unlike the first film adaptation, which contained many changes, Barbeau-Lavalette’s film remained more faithful to the book.",vinayak,"In the first film adaptation, director Samuel Fuller entirely wrote out the character of Gary, replaced Seberg with a younger fictional actress, and recast the story as a horror film centred on the dog itself. || In contrast, Barbeau-Lavalette remained more faithful to the original book.","Unlike the first film adaptation, which was entirely written out by director Samuel Fuller, had a younger fictional actress replace Seberg, and recast the story as a horror film centred on the dog itself, Barbeau-Lavalette remained more faithful to the original book.","Unlike the first movie, Barbeau-Lavalette did not change the character of Gary. || The first movie, directed by Samuel Fuller, changed the character of Gary, replaced Seberg with a younger actress, and made the story about the dog itself."
18,"Described as a darkly comedic bio-pic, Emilia Jones was confirmed to be portraying the whistle-blower Reality Winner from a script written by Kerry Howley based on her own 2017 New York Magazine feature, ""Who Is Reality Winner?"" with Fogel also on board to direct.","Emilia Jones will play the whistle-blower Reality Winner from a script written by Kerry Howley. || It is based on her own feature, ""Who Is Reality Winner?"" || and Fogel will direct.",kelly,"In the New York Magazine movie, “Who is Reality Winner?”, Emilia Jones portrays the whistle-blower known as Reality Winner. || The script was written by Kerry Howley with Fogel directing.",anton,"Emilia Jones will portray the whistle-blower Reality Winner in a bio-pic that is described as darkly comedic. || The script was written by Kerry Howley based on her own 2017 New York Magazine feature, ""Who Is Reality Winner?"" || Fogel is on board to direct.","Emilia Jones will portray Reality Winner, the whistle-blower, in a dark comedy bio-pic. || Kerry Howley wrote the script, which is based on her own 2017 New York Magazine feature, ""Who Is Reality Winner?"" || Fogel will also direct the movie.","Described as a darkly comedic bio-pic, Emilia Jones was confirmed to be portraying the whistle-blower Reality Winner with Fogel also on board to direct from a script written by Kerry Howley based on her own 2017 New York Magazine feature."
19,"There is general acknowledgment among the mediators, as well as some outside observers, that this agreement represents a step towards peace, but that true peace had yet to be fully realized.","There is agreement among meditators that this agreement is a step toward peace, but true peace hasn’t been realized yet.",ayush,"Outside observers and mediators think that this agreement is a step towards peace. || However, they think that true peace has not been fully realized yet.",vishnesh,"Most mediators and some outside observers agree that this agreement is a step towards peace, but true peace has not been achieved yet.","Mediators and some outside observers agree that this agreement is a step towards peace, but true peace has not yet been achieved.","There is general agreement among the mediators that this agreement is a step towards peace. || However, there is also agreement that true peace has not yet been realized."
20,"Whereas earlier major protests, which were violently quelled by Iran's government, focused on election results or economic woes, the current protest, besides increased rights for women, has one main demand: the overthrow of the Islamic Republic.","Earlier major protests focused on election results or economic problems and were violently stopped by Iran’s government. || In addition to increasing women’s rights, the current protest has one main demand: the overthrow of the Islamic Republic.",rachel,"Where earlier protests focused on election results or economic issues, the current protest, other than more rights for women, has one demand: get rid of the Islamic Republic.",ayush,"Whereas earlier major protests were quelled by Iran's government, the current protest has one main demand: the overthrow of the Islamic Republic.",Earlier major protests were violently stopped by Iran's government. || These protests were about election results or economic problems. || The current protest is about getting more rights for women and the overthrow of the Islamic Republic.,"Earlier major protests, which were violently quelled by Iran's government, focused on election results or economic problems. || The current protest, however, has one main demand: that the Islamic Republic be removed from power."
21,"In a difficult situation, it encouraged him to study Graphic Design in 2007, and he's been since as a Cinematographer in the film industry, also his have a lot of experience with photography and experience in the field of graphic design.","A hard situation encouraged him to study Graphic Design in 2007. || Since then, he’s been a Cinematographer in the film industry. || He also has a lot of experience with photography and graphic design.",kelly,"During hard times, he was led to study Graphic Design, and after that became a cinematographer. || Also, he had a lot of experiences with photography and graphic design.",anton,"In a difficult situation, he decided to study Graphic Design in 2007. || Since then, he has been working as a Cinematographer in the film industry. || He also has a lot of experience with photography and graphic design.","In a difficult situation, he studied Graphic Design in 2007 and has since been working as a Cinematographer in the film industry. || He also has a lot of experience with photography and graphic design.","In a difficult situation, it encouraged him to study Graphic Design in 2007, and he's been since. || He has a lot of experience in the film industry, and he also has a lot of graphic design and photography experience."
22,"In addition to farming, Corbin has expanded his business to include agritourism, using his farm to host weddings, host corporate meetings, and attract visitors to a large annual Christmas-themed display.","Corbin has expanded his farming business to include agritourism. || He uses his farm to host weddings, corporate meetings, and a large annual Christmas-themed display.",rachel,"In addition to farming, Corbin’s business also offers agritourism. || Corbin uses his farm to host weddings, host corporate meetings, and attract visitors to a Christmas display every year.",kelly,"In addition to farming, Corbin has expanded his business to include agritourism. || This means that he uses his farm to host weddings, corporate meetings, and attract visitors to a large annual Christmas-themed display.","Corbin's farm isn't just used for farming-- he's also expanded his business to include agritourism. || This means that his farm is used to host weddings, corporate meetings, and attract visitors to a large annual Christmas-themed display.","As well as farming, Corbin has started a small business called ""Agritourism"". || He uses his farm to host weddings, business meetings, and a big Christmas display every year."
23,"An activist hiding his identity said the Egyptian authorities were carrying out random detentions ahead of COP, where they are randomly stopping people and inspecting their mobile phones to look for any evidence of dissent.","An activist said the Egyptian government was doing random phone searches ahead of a climate change conference. || During the search, they were looking for any evidence of dispute with the government.",anton,"An activist hiding his identity said Egyptian authorities were randomly interrogating people ahead of COP, such as randomly stopping people and inspecting their phones for dissent.",ayush,"An activist who did not want to reveal his name said the Egyptian authorities were arresting people without a reason before COP, where they stop people randomly and look at their cell phones for any proof of disagreement.",An activist who wants to stay anonymous said that the Egyptian authorities are arresting people without a reason before COP. || They are stopping people and checking their phones for anything that shows they disagree with the government.,An activist who did not want to be named said the Egyptian government was holding random arrests ahead of COP. || He said they stopped people at random and checked their phones to look for evidence of dissent.
24,"Football fans around the world may find some apprehensions about going to the World Cup in Qatar because of the alcohol laws concerning consuming alcohol in public places, but World Cup organizers announce the creation of designated ""sobering up"" zones as a way to make fans feel safe and comfortable while attending the World Cup.","Football fans may not like going to the World Cup in Qatar because of its alcohol laws, but organizers announced the creation of “sobering up” zones to make fans feel safe while attending.",ayush,"Fans around the world are unsure about going to the World Cup in Qatar because of its alcohol laws. || In response, World Cup organizers say they will create “sobering up” zones to make fans feel safer.",vinayak,"Football fans around the world may have some concerns about going to the World Cup in Qatar because of the alcohol laws concerning drinking in public places, but World Cup organizers have announced the creation of designated ""sobering up"" zones as a way to make fans feel safe and comfortable while attending the World Cup.","Some football fans might be nervous about going to the World Cup in Qatar because of the alcohol laws, but World Cup organizers are setting up areas where people can drink alcohol so that fans feel safe and comfortable.","Football fans around the world may find some apprehensions about going to the World Cup in Qatar because of the alcohol laws, but World Cup organizers say that they will have ""sobering up"" zones where people will be told not to drink alcohol while watching the games."
25,"On 3 November 2022, the British Foreign Secretary James Cleverly announced that the UK and Mauritius had decided to begin negotiations on sovereignty over the British Indian Ocean Territory, taking into account the recent international legal proceedings.","On 3 November 2022, the British Foreign Secretary James Cleverly declared that Mauritius and the UK would begin talks to discuss control over the British Indian Ocean Territory. || This was taking into account the recent international legal proceedings.",vishnesh,"On November 3rd, 2022, the British Foreign Secretary said the UK and Mauritius were discussing granting independence over the British Indian Ocean Territory.",ayush,"On 3 November 2022, the British Foreign Secretary James Cleverly announced that the UK and Mauritius had decided to begin negotiations on sovereignty over the British Indian Ocean Territory. || This decision takes into account the recent international legal proceedings.","On 3 November 2022, the British Foreign Secretary James Cleverly announced that the UK and Mauritius had decided to begin negotiations on sovereignty over the British Indian Ocean Territory.","On 3 November 2022, the British Foreign Secretary James Cleverly said that the UK and Mauritius had decided to start talks to take over the British Indian Ocean Territory. || This was because of legal cases that were going on before."
26,"Blogger DJ Akademiks held a three-hour stream in honor of Takeoff, in which he analyzed videos from the moment of the murder of Kirshnik, and also called for fighting the ideology of violence in hip-hop, including stop imitating rappers YNW Melly and Tay-K, who were convicted of murder.","Blogger DJ Akademiks held a three-hour long stream to honor Takeoff. || In this stream, he analyzed videos from the moment of Kirshnik’s murder. || He also asked people to challenge the use of violence in hip-hop and to stop copying rappers like YNW Melly and Tay-K who were convicted of murder.",vishnesh,"The blogger DJ Akademiks held a three hour stream to honor Takeoff, where he analyzed videos from the moment of Takeoff’s murder. || He also said we have to fight violence in hip-hop, and that we should not copy rappers like YNW Melly and Tay-K, who were murderers.",anton,"DJ Akademiks held a three-hour stream in honor of Takeoff. || He analyzed videos from the moment of the murder of Kirshnik and also called for fighting the ideology of violence in hip-hop. || This includes stop imitating rappers YNW Melly and Tay-K, who were convicted of murder.","DJ Akademiks held a three hour stream to remember Takeoff. || He analyzed videos from the moment of the murder of Kirshnik and called for people to stop promoting the idea of violence in hip-hop. || This includes stop imitating rappers YNW Melly and Tay-K, who were both convicted of murder.","Blogger DJ Akademiks held a three-hour stream in honor of Takeoff, in which he analyzed videos from the moment of the murder of Kirshnik, and also called for people to stop copying rappers who were convicted of murder, including YNW Melly and Tay-K."
27,"Once inaugurated in January 2023, she will become the first female Governor of Massachusetts as well as the first openly lesbian woman and third openly LGBT person (after Kate Brown and Jared Polis) to take office as governor of a U.S. state.","She will officially start her position as Governor of Massachusetts in January 2023. || When this happens, she will become the first female Governor of Massachussets. || She will also be the first openly lesbian woman and third openly LGBT person to take office as governor of a U.S state.",vishnesh,She will become the first openly lesbian woman and third openly LBGT person to be governor of a U.S. state.,vinayak,She will become the first female Governor of Massachusetts in 2023. || She will also be the first openly lesbian woman and third openly LGBT person to take office as governor of a U.S. state.,She will become the first female Governor of Massachusetts in January 2023. || She will also be the first openly lesbian woman and third openly LGBT person to take office as governor of a U.S. state (after Kate Brown and Jared Polis).,"When she takes office in January 2023, she will be the first woman governor of Massachusetts and the first openly lesbian governor of any U.S. state. || She will also be the first openly lesbian governor of any U.S. state."
28,"The sitcom series features the story of Abi (played by Bolu Essien) who secures a job at a top advertising agency in Lagos, although she had a rough start with her superior, she soon got an opportunity to shine at work when she was promoted to become the acting manager after the manager traveled to another branch.","The sitcom series is about the story of Abi who gets a job at a top ad agency in Lagos. || Though she has a rough start with her superior, she gets a chance to shine at work when she is promoted to acting manager. || This happens because her manager travels to another branch.",vishnesh,"The sitcom series is about Abi, who gets a job at a top advertising agency in Lagos. || She eventually became acting manager after her hostile manager left to another location.",vinayak,"This sitcom series is about Abi (played by Bolu Essien). || At the beginning, she got a job at a top advertising agency in Lagos. || Her superior wasn't nice to her, but she had a chance to show her talent at work. || After the manager traveled to another branch, Abi was promoted to become the acting manager.","Abi (played by Bolu Essien) is the star of the sitcom series. || She got a job at a top advertising agency in Lagos, even though she had a rough start with her boss. || She got promoted to acting manager when the manager had to travel to another branch.","The sitcom series features the story of Abi (played by Bolu Essien) who secures a job at a top advertising agency in Lagos, although she had a rough start with her manager, she soon got a chance to show off her talent when she was promoted to become the acting manager of the agency."
29,"However, upon Flynn's apparent success in securing sufficient backing to become council president, Arroyo released a statement that acted as an informal concession of sorts, giving strong praise to Flynn's kindness and work ethic, and declaring that he looked forward, ""to seeing how he utilizes those great qualities in this leadership role.""","When Flynn got support to become council president, Arroyo sent out a message. || The message was an informal concession that praised Flynn’s kindness and work ethic. || It also said that he looked forward, ""to seeing how he utilizes those great qualities in this leadership role.""",kelly,"When it was clear Flynn was going to be council president, Arroyo gave a concession speech. || He praised Flynn’s good qualities and said that he wants to see Flynn use these qualities while president.",vinayak,"However, upon Flynn's apparent success in securing sufficient backing to become council president, Arroyo released a statement. || In the statement, Arroyo gave strong praise to Flynn's kindness and work ethic. || Arroyo also declared that he looked forward to ""seeing how Flynn utilizes those great qualities in this leadership role.""","After Flynn got enough support to become council president, Arroyo released a statement that was like a concession. || He praised Flynn's kindness and work ethic, and said that he looked forward ""to seeing how Flynn uses those qualities in this leadership role.""","However, after Flynn was able to get enough support to become council president, Arroyo said that he was happy for him. || Arroyo said that he was happy for Flynn's kindness and work ethic, and that he looked forward to seeing how Flynn used those qualities in his new job."